Ny regering må ændre skattepolitikken. Ikke overraskende viser analyse af indkomstskattelettelser i perioden 2002-2017, at de største lettelser er gået til de rigeste, målt relativt. Samtidig flere fattige børn og social ulighed. [LINK] #dkpol #ulighed #OgDetErDK [LINK]	negativ
@USER Jeg tænker man mere dybdegående skulle udfordre vores system og stille laaaangt flere kritiske spørgsmål til dem der virkelug styrer #dkpol og #dkmedier her lidt inspiration [LINK]	neutral
Point - men suspendering - tid på bænken - er IMO kun en fordel for den suspenderede. 
Lidt som at udsætte brexit, men igen - det er bare min mening. [LINK]	negativ
🇩🇪 er i den grad gået i flyverskjul med Visegradlandene.

🇩🇰🇫🇷🇱🇺🇪🇸🇵🇹🇫🇮🇸🇪 kæmper for klimaneutralitet senest i 2050 på linje med Parisaftalens 1,5-gradersmålsætning. Men det bliver svært.

TRÅD om, hvorfor Tyskland har sat sig bagerst i klassen, når det gælder klimaet.
#dkgreen [LINK]	negativ
I Skive kan man forvandle søstjerner til dyrefoder, og dermed går en god forretning hånd i hånd med en klimaindsats ⭐️💛 Nysgerrig? Læs mere her: [LINK] #dkgreen #landbrug #dkbiz	positiv
Det er ikke Rød/Blå der gør forskellen, men at @USER endnu ikke har haft så godt fat om magten, at de er blevet tilbudt en konkurrencedygtig pris for deres principper.

Alle de "gamle" partier har forlængst solgt deres sjæl og principper til højestbydende. [LINK]	negativ
@USER [LINK]

Godkendelsen er ugyldig. Dette faktum går ikke væk bare ved at lade som ingenting. Det går der i mod kraftig udover retsfølelsen og tilliden til politikerne. Der skal ryddes op! #dkpol 

[LINK]	negativ
Regionsrådsformand @USER (med ryggen til) til dialogmøde på @USER Hospital på Amager for at lytte til klinikere om #sundhedsplatformen og fremtiden for et 'lille' hospital som Amager. #sundpol [LINK]	neutral
Jo længere du venter med at trykke på valgknappen @USER, jo mere fremstår du som en #dkpol Tøsedreng! Dermed risikerer du også at meningsmålingerne, bare bliver dårligere, og dårligere! 😁😁😁 [LINK]	negativ
Det må vist kandidere som et at de mest kommenterede tweets i denne uge under #dkpol 
Når kommentarer læses, så siger det mig, nogen er ude af sync...😎
Lad os nu få det valg, inden flere skøre ideer bliver omsat til love [LINK]	negativ
Nyheden om koranafbrænding herhjemme omtales i arabiske medier. En af reaktionerne nederst: 

"Vi skal aldrig modsvare den slags opførsel ved at brænde deres hellige bøger eller gengælde deres angreb på vores profet ved at nedgøre elskede Jesus og Moses."
#dkpol [LINK]	neutral
Konkurrencestater kommer i forskellige varianter, og det samme gælder for den danske konkurrencestat 🇩🇰. Nysgerrig? Køb 'Konkurrencestatsministeren' her: [LINK] #dkpol #dkøko [LINK]	positiv
Jeg skulle hilse og sige fra min far, at I skal slappe af med den omfartsvej i Mariager. Og at der er en udmærket omfartsvej nede ved havnen. Og om @USER gider kigge på om nordsjællandmotorvejen ikke snart kan føres længere op? De har ventet siden 1950. Tak. #dkpol	negativ
Ankommet til Thy, har lige set “Thy Dance and HipHop 5. - 6. klasse” troede de ville twerke, det skete heldigvis ikke. #luckyme #dkpol #spildafliv #thyhallen	positiv
@USER @USER @USER @USER Du mener måske endda, at vi i stedet burde hylde grupperinger som modarbejder demokrati og opfordrer til drab af jøder. #dkpol	negativ
Ak ja, havde det nu været vores opgave, så havde vi da hurtigt fået drejet den over på, det det må være en eller anden Mettes skyld. [LINK]	negativ
Det kan være lidt småsvært at være socialdemokrat og finde et parti, der repræsenterer en i 2019's Danmark. Men det må da være komplet umulig at være liberal. #dkpol	negativ
📻 Her fra Nordjylland er jeg stor tilhænger af "If it ain't broken – don't fix it!". Og det betyder jo, at man bør lade Radio @USER blive liggende, hvor det ligger! #dkpol	positiv
Innovationsværkstedet på Transport 2019 bød også på en reel pre verdenspremiere #dktrp #dkgreen #dkbiz @USER @USER @USER @USER [LINK]	neutral
Verdens bedste parti-fe fylder 85 år. Hvilken alder. Hvilken kvinde. Hvilket liv. @USER hepper og sender de grønneste fødselsdagshilsener til the one and only: Jytte Abildstrøm. #dkpol [LINK]	positiv
LIVE: Krydstogsskib i havn - mange skal overnatte på skibet [LINK] B.T. tilsyneladende eneste danske medie på kajen i Molde. Følg udviklingen i vores live blog. #dkmedier	neutral
Føler mig langt fra fattig, venstreorienteret JA. Nogle må 
forsvare samfundets svageste når VLAK har valgt at nedgøre/ydmyge
dårligst stillede med fattighjælps ydelser ! "Elitens kloak"?
Når det regner med overflod i whisky bæltet får jeg råd til en ekstra øl
@USER	negativ
Kan tegn på ulovlig udenlandsk finansiering af Brexit-kampagnen underminere afstemningens gyldighed? - Under alle omstændigheder giver dette bremain-siden nye gode argumenter for at lade befolkningen spørge påny. #brexit #dkmedier
#eudk
[LINK]	positiv
Nyt vækstforløb kickstarter innovation i Det Blå Danmark. Fem danske startups er udvalgt til at samarbejde med landets største selskaber i den maritime branche.
[LINK] @USER #dkstartup #dkbiz #cphftw	neutral
Vores medlemsvirksomhed @USER påbegynder endnu et #DGNB projekt. "Med en lejer som @USER bliver Frederiks Plads et endnu mere attraktivt kontorområde, som bidrager positivt til udviklingen af #Aarhus bymidte," siger Ole Faurby,Læs mere:[LINK] #dkbyg	positiv
»Virksomheder gør ikke altid det, der er samfundsmæssigt mest nødvendigt. De skal hjælpes på vej. Og hvis du spørger de største danske virksomheder på de grønne områder, vil de sige det samme,« siger @USER i @USER #dkgreen #dkpol
[LINK]	neutral
#CentraliseringNejTak #DKPOL
Pinligt at lytte til VLAK+ DF
De har ikke styr på noget, ikke engang hvor mange ansatte der er i sundhedsvæsnet. Hvis man har udsultet regionerne i årevis, nu tilfører midler, som skal gå til nyt central Akut 113 og nyt IT system, virkelig borgernær	negativ
Yderligere nedsabling af integrationsområdet skal nu betale for vores sundhedssektor i en tid hvor regeringen har 40 milliarder i overskud på budgettet og hvor Rockwool fonden har vist, at integrationsbesparelserne øger kriminaliteten.
#dkpol
[LINK]	negativ
Seneste topnyhed på [LINK] : #nyheder Sundhedsreform på plads: Nye sundhedshuse, flere læger og sygeplejersker Danskerne skal opleve bedre sammenhæng, mere nærhed og større tryghed, når de behandlet i sundhedsvæsnet. [LINK]	positiv
24% af CO2-bidraget fra en gennemsnitlig danskers kost kommer fra søde sager, snacks og diverse drikkevarer (ekskl. mælk). Det er omtrent det samme som CO2-bidraget fra rødt kød, viser beregninger fra @USER #dkfood #dkgreen [LINK]	neutral
Svaret er blandt andet 70 år med europæisk fred, en styrket stemme i internationale anliggende og økonomisk fremgang 🇪🇺 [LINK]	positiv
Os der vil bevare Danmark Dansk og bevare vores kultur stemmer da på NB eller som nødløsning på DF. Personligt betragter jeg NB som vores bedste løsning fordi de er EU modstandere.! [LINK]	positiv
UVM_dk: Fire ud af de fem regioner har oplevet en stigning i andelen af elever, der søger en erhvervsuddannelse. Højdespringeren er Region Nordjylland, der ligger 1,5 procentpoint højere end sidste år. Godt gået!
#uddpol #dkpol #eud [LINK]	positiv
Det altså lidt vildt det her!

Schweizisk højrefløjspolitiker begrunder valgnederlag i at de “druknede i en grøn bølge”!

En “bølge” der opstod efter @USER’s tale i Davos.

Ringe i vandet folkens.
Noget er sgu i gære!

#GrøntValg
#dkpol #dkgreen
[LINK]	positiv
Også i Sverige laver den ene hånd initiativer med store CO2-emissioner til følge, mens den anden hånd laver lappeløsninger for at reducere emissionerne. #swgreen #dkgreen [LINK]	negativ
‘Jeg er nu nået til den konklusion, at det allerværste ved mig er, at jeg er en kvinde, man ikke kan lukke munden på.’ Læs og måb, når @USER fortæller fra debattens stormende bølgetoppe, hvor det fremgår at kvinder - de skal bare holde deres kæft. #dkpol [LINK]	negativ
Er det sjovt at høre fire økonomer snakke om renter og befolkningsudvikling i 25 minutter? Det var i hvert fald sjovt at lave. Hør med her (på engelsk). #dkøko [LINK]	positiv
En skov må gerne smage godt. Foruden etablering af stier og skovenge plantes også frugttræer i denne skov - fremover kan man på en gå tur her bl.a. plukke kirsebær, æbler, pære og morbær - der plantes ialt 150 frugttræer #dkgreen [LINK]	positiv
For 12år siden da jeg var pressechef på Mungo Park. Lavede vi en teaterforestilling om Sandholm Lejren, baseret på samtaler med beboerne. Så mange år senere og hvad har vi lært/gjort for at give familier og børn der kommer med kæmpe traumer en tryg base: 

[LINK]	neutral
Jeg skal da lige love for, at man tydeligt mærker at @USER skriver for avis med et borgerligt værdigrundlag. Det antydes kraftigt, at vi nok ik helt kan stole på, at sygeplejersker, SOSU’ere og pædagoger er mere og mere pressede. Hold da op. #dkpol [LINK]	negativ
Det hænger ikke sammen - overhovedet - og er slet ikke gennemtænkt! #NokerNok #Jarlovsyndromet #ForbandedeHyklere #dkpol #dkmedier [LINK]	negativ
@USER @USER @USER @USER Hang de heller ikke sammen i den forstand, at techgiganterne finansierede en pæn del af NGO'ernes arbejde?	negativ
@USER Mht. kildekritik: det afgørende er den første time, de allerførste "sensationelle" historier. De er baseret på partsindlæg, men de når øjeblikkeligt ud til +1 mill. mennesker.
Alle detaljerne, der kommer senere, med højere kvalitet, kan ikke slette det første indtryk
#dkmedier	negativ
@USER Radio24syv vil ikke søge om forlænget sendetilladelse,det er deres valg og hvis de ikke havde klaget var det kun 50% af de redaktionelle medarbejdere der skulle arbejde fra provinsen.
KLYNK KLYNK FRA VRØVLE HOVEDER:
Hvad med lidt selv-indsigt"🤔
#dkmedier #dkpol #dkbiz	negativ
Hvorfor melder de samme ikke når børn medbringes til demonstrationer - ganske vist bag fædrene - de må jo være på lige fod #dkpol [LINK]	negativ
@USER Men altså Borgen S vil jo ikke lave det om...Er det mon #dkpol udkantspopulisme, løbe efter DF, der driver @USER i denne #dkmedier sag? Er dette en sag som SF vil stille som krav for at støtte Mette F?	neutral
Vi er prisgivet de få psykiatri-uddannede der er. Psykologer, psykiatere, socialpædagoger, psykiatri-sygeplejersker. En sosu kan sørge for mad, pleje og opretholder en "normal" hverdag og tale med os, men de har ikke teorien med sig #sundhedsreform #dkpol #sundpol #Debatten	negativ
Seneste nyt fra Danmark og Verden #nyheder: Køen til arbejdsmarkedet rykkede sig ikke i februar Der var næsten ingen ændring at spore i køen til arbejdsmarkedet i februar. Hvor der i januar var 103.000, var der i februar 103.100.
Dermed er procentdelen a… [LINK]	neutral
Landbruget er en del af løsningen på klimaudfordringerne, sagde Anne Ahrnung @USER til klimadebat. Vi står for 20% af udledningerne, men vi har også forpligtet os til at reducere og være en del af løsningen. #dkfood #dkgreen #SustainableDairyEU [LINK]	positiv
@USER @USER @USER Jeg kigger skam i skemaet. Jeg bor nemlig lige op ad i terrænet. Går ture i naturen derude. Og når i skriver en artikel som denne afleverer i et falsk indtryk af forholdne. Problemstillingen er ikke ny. Men der er en politisk dagsorden om #LukSjælsmark.	negativ
@USER @USER Der vil jeg anbefale at du læser op på hvad de facto betyder. Det svarer til at lovgive om at svin skal slagtes på Grønland og derefter undre sig over at slagterier lukker.	negativ
Hvordan implementerer man bevægelse i skolen? Det havde @USER fra @USER gode bud på i sit oplæg på @USER og @USER netværksdag forleden. Hør fx pointen om Parathedsskamlen i videoen herunder. #skolechat #idrætspol #uddpol [LINK]	positiv
Vores alle sammen kommede udenrigsminister slår til igen på twitter @USER 1
@USER 0
# Kom nu ind i den moderne kommunikationverden.	negativ
@USER @USER @USER @USER @USER Ja, og sådan vil det være. Jeg er ikke i tvivl om, at der vil være andre tidspunkter, hvor tv-kanaler vil have et større panel, men størrelse på parti er altså ikke en fuldstændig arbitrær skillelinje.	neutral
Først lukker de DRK, men ok, jeg r jo ik kultur/historieinteresseret. 
De kom efter P6Beat, jeg protesterede ik, for jeg ejer ik rytmesans.
Så gik de efter #24syv jeg protesterede ik, jeg lytter lydbog. 
Når de kommer efter mig, r der ik flere tilbage t at fortælle nyheden
#dkpol [LINK]	negativ
@USER @USER Epinion skrev for nogle år tilbage lidt om, hvordan de gør. Og det er som sagt meget forskelligt fra sted til sted. Går og pønser på at skrive lidt om det, fordi folk generelt tolker meget på de (forskellige) tal 2/2 [LINK]	neutral
Jeg har gennem længere tid ønsket at åbne en burgerkæde og har derfor researchet benhårdt. Jeg har tons af data, der beviser, hvor de andre kæders kundekontakt er svær og træls. Det problem løser min kæde. #dkentrepreneur #løvenshule #iværksætter [LINK]	positiv
@USER @USER @USER @USER @USER @USER En kvinde kan sagtens være maskulin og stadig fremstå som kvinde🙂 men det er jo netop DET, som Mette Frederiksen (og andre kvinder med magt) ofte forsøger at undgå - at fremstå som kvinder. Fordi normen er, at det maskuline fremstår mere troværdigt og slagkraftigt.	negativ
Robert Smith teaser flere detaljer om nyt The Cure-album: »Det er fucking fantastisk«

Roskilde Festivaler-hovednavnet The Cure fik i weekenden en hæder af de helt store, da de blev tildelt en plads i ’Rock &amp; Roll Hall of Fame’, og frontmand Robert Smith… [LINK]	positiv
@USER @USER @USER @USER @USER @USER Jeg vil til dette lige påpege at POV valgte at dække hverken Dumbo eller Dronningen, men derimod 'La Flor' ;)	positiv
@USER @USER @USER @USER @USER @USER Kan varmt anbefale ovennævnte kolleger. Derudover også bla @USER (participatory design + human-computer interaction), @USER (social media), @USER (privacy) mfl.
Stiller gerne selv op, holdt for nylig oplæg: Do we shape technology or does technology shape us?	positiv
Det her er ret vildt! Vi har et fælles politisk ansvar for ikke at sælge drømme - som ikke kan realiseres indenfor det afsatte budget! @USER skylder danskerne den ærlighed. #dkpol [LINK]	positiv
Det er oplevelser som det hér, lytterne og jeg skal undvære i januar 2020. Hele mit liv har jeg været en underdog, udenfor, uhip, uncool, interesseret mig for ting, som majoriteten ikke gør. Og jeg har nydt det. Fuck mig, det bliver svært at undvære denne del: [LINK]	negativ
En skilsmisse er en livskrise for både børn og deres forældre. @USER hilser ny skilsmisseaftale velkommen, for der er markant behov for at støtte forældrene i at huske, at deres beslutninger omkring bruddet har konsekvenser i børnehøjde #dksocial #dkmedier [LINK]	positiv
Lise Kaaberbøl, politiker og husmor, kæmpede for det gode skoleliv Billund: Det er ikke de fire år som politiker, der fylder. Heller ikke arbejdslivet, der nok var spændende, og som tog en drejning undervejs. Det er familien, det hele drejer sig om. Det … [LINK]	neutral
@USER @USER @USER @USER @USER @USER @USER @USER @USER De er tosset med det kommer nok af at de ikke spiser KØD .De kan jo gøre som de vil men de skal ikke blande sig i hvordan andre lever	negativ
Sana er gået fra, at ikke skulle sælges for under 1 mill euro, til at bare der er en klub, som vil overtage hans løn. #Harsh #ultratwitteragf #sldk	negativ
Uheld på Københavnsvej i Vordingborg gav lange køer mandag eftermiddag. 
#fuh #uheld #ulykke #vordingborg #politidk #nyheder [LINK]	negativ
@USER @USER Er så bra at de sender dette 🤩 Og det ikke mange vet er at norske Quick Style har laget koreografien til Save me og Blood sweat and tears! 🤩	positiv
@USER Det så altså mærkeligt ud. Er de 13 år gamle? Man skal da ikke blive hængende oppe i GFs felt i overtiden, når man er foran 2-1. Suk	negativ
@USER Jeg har normalt stor respekt for dit arbejde Klaus. Men her må jeg erkende, at hvis det JN står på TV og siger igår er korrekt. Så har har du godt nok strammet den...artiklen og overskriften anklager utvivlsomt AGF for at stjæle sig adgang til data, det er ikke korrekt.	negativ
Enig meg Morten #Østergaard. Jeg var bange at det kun mig som mærker at S har næsten samme retning som DF. For at fiske stemmer Mette kan 
lave er aftale med alle.. uanset at det er godt eller dårligt til DK i fremtiden #dkpol [LINK]	negativ
@USER Det var nu mere uklarheden i R-udmelding jeg spørger til. Til dit spørgsmål: Enhedslisten vil have indflydelse på alle områder hvis vi skal acceptere en S-regering. Hverken de, vi eller R kan diktere 100%	negativ
Var det før sæsonen utænkeligt, at Arsenal skulle formå at ende foran Tottenham i tabellen - eller overdriver Sherwood? #pldk [LINK]	neutral
@USER Øh bøb - modsat den såkaldte "Blå blok"? DF går til valg på at vælte den siddende regering, så DF selv kan komme i regering og LA sparkes ud. NB har 3 ultimative krav. DF vil gerne støtte Mette, hvis det kan holde RV ude. DF ved man ikke, hvor man har? #dkpol	neutral
HJÆLP! Var i færd med at opdatere iPhone6 via iTunes, da jeg får FEJL 14. Sker med forskellige kabler og computere. Nu er jeg nødt til at gendanne min iPhone fra scratch, hvis jeg ikke kan fuldføre opdateringen. Nogle gode fifs til, hvad jeg gør? #twitterhjerne	neutral
"Hvad skal vi kalde det her, hvis vi ikke må kalde det for pølser? Det er jo pølser" Ja, EU's landbrugsudvalg er desværre fodslæbende, når det kommer at hjælpe overgangen fra kød til planter - stik mod udbredt folkelig appetit #dkgreen #dkfood #eudk [LINK]	negativ
Kommentar: Det er vel ikke en naturlov, at Tyskland og Frankrig skal ligge i struben på hinanden [LINK] [LINK]	negativ
@USER @USER så burde det også være muligt at lægge så meget ad-hoc som muligt onsdag eftermiddag. Vi har det ikke — det er en kamp uden lige at få fire personer til at mødes med mindre man kigger 3-4 mdr ud i fremtiden.	negativ
Jeg snakker om Serie A på @USER sammen med @USER og @USER. Det er faktisk blevet rigtig godt, så lyt lige med [LINK]	positiv
Slack Master Flash!
Hvis vi skal bruge Slack i en mindre virks - hvilken platform skal vi vælge? Der R Slack for IT, engeneering, kunder osv
Vi skal bruge Slack til kommunikation, udvikling, styr på kunder osv - alt det er ikke er fedt på mail. Hvad skal vi vælge?
#twitterhjerne	neutral
@USER @USER @USER @USER Hej Ronnie. Ingen af os stillere er medlemmer af @USER 
Just sayin. Kandidater og lokalpolitik er vel også for borgere? #dkpol [LINK]	neutral
@USER @USER @USER @USER Forud for energiaftalen slog vi bare fast, at vi skulle bygge MINDST én havpark hurtigst muligt. Men de ekstra udbud vi lavede af landvind, stemte I ikke for - men I havde jo også kun afsat NUL kroner til klima og energi i jeres finanslovsudspil #dkgreen #dkpol	negativ
Brug lige 6 minutter af din tid her.. 
Det er det værd &lt;3 
og så ER DET på tide, at vi begynder at tale sammen &lt;3 

Tak, Mazen &lt;3 

PS: Mine døtre gæster videoen lidt hist og her.. Papa er stolt, ja han er &lt;3 😍 [LINK]	positiv
@USER @USER @USER @USER @USER @USER @USER 1. Det er politiets opgave at holde øje med om færdselslovens krav til køretøjer overholdes. Det gælder såvel cykler som el-løbehjul.

2. Der er det højeste antal betjente siden 2007.	neutral
@USER @USER @USER Det antyder bare, du ikke er journalist men politiker, og du ikke kender forskel på de to jobs. 
Jeg kan selvfølgelig være ligeglad. Jeg tilhører tydeligvis ikke din målgruppe, som er Folketinget.	negativ
@USER @USER @USER Enig i der ikke nødvendigvis er tale om Interpol-lige crimes her. Forsøgte egentlig bare at illustrere at det for mig at se udefra ligner at alle involverede parter er amatører. 😅	positiv
I en tid hvor retorikken spidser til op til valg, er det forfriskende at se et politisk indslag med humor og glimt i øjet fra @USER @USER (som selv er genstand for debat og pres) samt @USER. God stil! 👏 #dkpol [LINK]	positiv
.@USER var vært, da @USER og erhvervslivets top her til aften underskrev en erklæring, der bl.a. handler om at sætte fokus på fremtidens bæredygtige materialer og produkter♻️ #dkgreen #dkbiz #dkpol [LINK]	positiv
@USER @USER @USER @USER Agf ville meget gerne gøre diskussionen til et spørgsmål om hacking eller ej. 
Faktuelt har jeg brugt ordet i vores første overskrift i sagen og en afsluttende sætning i første artikel. Ordet bruges bredt om uautoriseret adgang, men det er upræcist. Ikke anvendt yderligere af mig	negativ
Rigtig godt at @USER på #idrætstopmøde taler om kropsforskrækkelse og at medier er fyldt m perfekte kroppe. Det er en barriere for at få flere unge -især kvinder- til at dyrke idræt sammen i foreninger. Men det skader også unges psykiske trivsel.#dkpol #ungpol #sundpol [LINK]	positiv
@USER Det er jo også kun 0,861 % af den danske befolkning, ligesom det kun er 0,0000016 % af den danske befolkning der bestemmer vores love :p	negativ
Så er det nu, forslaget er godkendt @USER @USER

Støt borgerforslag om at redde @USER 
 
Skriv under på borgerforslag, del og like @USER @USER @USER
 
#DKPOL #DKMedier @USER @USER @USER @USER  [LINK]	positiv
For 30 år siden var der 15 landsdækkende handicapvidenscentre. I dag er der et. Nu styrker @USER Parasport Danmark og Handicapidrættens Videnscenter viden på handicapområdet i nyt, uafhængigt videnscenter. Godt initiativ. #dkpol #dkhandicap
[LINK]	positiv
En af fordelene ved at være placeret i #svendborg er, at man kan fange sin frokost lige uden for døren. Her er det Lasse der forsøger at fange fladfisk. #kystfiskeri #svendborgsund [LINK]	positiv
@USER @USER Fuldstændig korrekt. Dyr er vidst forskellig når det angår intelligens. 

Jeg nævnte name the trait tidligere og hvis vi prøver det argument med intelligens vil vi se at det er en dårlig måde at skille hvem der må dræbes og ikke må.	neutral
@USER @USER Altså, biler IDAG (Især lastbiler og busser, en del tog)kører jo faktisk på brændstof baseret på olie
hvor mange kilometer kan en lastbil køre på strøm?
for lang ladetid har en elektrisk lastbil?
Findes de overhovedet idag? 
vi vil nok gerne have varer leveret. vi skal bruge olie	negativ
Jorden-bamsen rækker ud efter stjernerne🚀@USER Little Earth 🌎, som vi sælger i museumsbutikken, er taget på rumrejse og blevet berømt...👀 #StenoMuseet #Aarhus @USER [LINK] [LINK]	neutral
@USER @USER I det omfang det lader sig gøre, er det altid klogt men ikke altid muligt på en forlænget rejsetid i arbejdstiden... #pendlerliv	neutral
I forhold til møntkast kan man vel dårligt klandre vores elever for bedre at kende historien end så mange andre i #dkpol. Ingen nævnt fra DF, ingen glemt (fra DF).
[LINK] #dkpol #ørestadgate #møntkast @USER #PastorLilleLøgn	negativ
Måneder er gået med forberedelse, øvelse og træning - både på dansegulvet på landeveje og på Møns Klint. Nu er det nu! Danmarksmesterskab i weekenden. :-) [LINK]	positiv
@USER @USER @USER Plast skal bruges med omtanke og aldrig ende i naturen. Og genanvendelsen skal blive bedre! Når det så er sagt, så har plastemballage mange fordele. Det passer på fødevaren, forlænger holdbarheden og forebygger madspild: [LINK]	neutral
Det er helt ude i hampen, DF og regeringen har tilsyneladende ingen jordforbindelse mere. Udrejsecenteret, kan DF og regeringen kun holde sig selv ud tilsyneladende, da man vil oprette en lejer på en ø, som man så vil sørge for at der er så få afgange til som muligt det er sygt [LINK]	negativ
Udskolingen forb. til gymnasiet, der også giver stor fleksibilitet ift videre uddannelse. Er det er ‘valg’ at vælge gymnasiet? Hvordan kan de unge blive nysgerrige og modige, til at træffe egne valg, når de møder UPV der anvender normen egnet/ikke egnet #uddpol #ungederblomstrer	negativ
Med frygt for at blive lynchet - eller ringet op og udstillet direkte i æteren, så er det her indspark pænt meget spot on. Hovedet på sømmet langt henad vejen. #dkmedier [LINK]	positiv
Kan vi sammen arbejde på, at al strøm leveres fra vindkraft, og at vores servere kører på bæredygtig energi?
#fremtidenergrøn [LINK]	positiv
Rektor @USER: En bæredygtig løsning er den, som både gør brug af nye teknologier og klimarigtige materialer, og som samtidig appellerer til folks værdier, identitetsopfattelse og smag. Det er den slags løsninger, vi viser eksempler på i Rigsdagsgården @USER #SDG [LINK]	neutral
Hvis du ikke vil stemme på Mette, Morten@USER, så er der Venstre, som har en hårdere udlændingspolitik. Så er der dig selv. Hvor tror du, at du kan samle stemmer til din politik på udlændingeområdet?#dpol	neutral
@USER @USER Slemt? 🤣 Så skulle hun bare høre om Sverige🤔🤪
Integrationen går fremad, men udelukkende fordi tilstrømningen er stoppet. Kæmpesucces er vist endvidere en overdrivelse, bl.a. afhængigt af hvilke befolkningsgrupper man gør det op i. Danskerne ER humane og ordentlige mennesker👍	positiv
@USER @USER Under middle er vi enige i og vi har været alt fra fantastiske (Zurich og Rungsted kampe) til det mere hyppige piv elendige (nederlag til odense og herlev....). Helt klart under middle, men vil bare ikke male fanden på vægge fordi jeg har oplevet meget værre sæsoner 😅	neutral
“Vi skriver altså *indsæt årstal*” har virkelig aldrig været noget særlig godt argument - med mindre diskutionen er, hvilken dato der skal stå i højre hjørne af et dokument. Og han har jo ret. Det hører ingen steder hjemme! Men sgu da ikke fordi vi skriver 2019. [LINK]	negativ
