Absolut svimlende besparelser på udd. I NJ. Er der ikke bare en nordjysk politiker der tør prioritere kvalitet og bevarelse af stærke, attraktive nordjyske udd.? @USER @USER @USER @USER @USER #uddpol #Stop2pctNU @USER [LINK]	negativ
@USER Så skal alle fans ud og feje foran egen dør. 🧹Selv samme folk har på et tidspunkt kaldt en anden person for bøsse eller lignende, og det er fandme hellere ikke okay!	negativ
Spændende udvikling i #kenya som vil betyder meget for fremskridt mod #verdensmålene. Og det bygger på en ikke helt ny, men stadig utrolig vigtig innovation: offentlige investeringer i velfærd! #dkaid #dkpol [LINK]	positiv
@USER @USER At forestille sig scener, hvor folk bliver hevet ud af hus og hjem, skrigende børn, der rives ud af deres forældres arme for så ‘at smide forældrene ud ad landet’. Det er horrible scener, der har historiske referencer. I stedet børnehave, skolegang, uddannelse. Det er vejen ud.	negativ
@USER Ja. Jeg ser en desperat fyr, der laver et Tweet hvor han forsvarer en handling, fordi det kun er sket 1 gang, over lang tid? Det svarer til at jeg slår en person, og forsvarer mig med, at “Jamen det er jo langtid siden jeg har slået nogle, så det går jo nok” God aften.😂🤫🤦🏻‍♂️	negativ
Det blev i dag kun til et godmorgen og godnat !
Godnat !
 Efter at have været sygemeldt i lang tid , er der meg👋😱💙et , som skal indhentes ! Så det er bare om at smøge ærmerne op og gå i gang !
✨❤🌹 [LINK]	positiv
Sønderborg: Anmeldelse om indbrud hos Shell på Alsgade. 6 minutter efter har patruljen anholdt en 36 årig gerningsmand, der har erkendt forholdet. Godt gået. Endnu et bevis på at tyveri ikke betaler sig. Vagtchefen #politidk	positiv
Opbakningen til at få bevillingen tilbage på 2016 niveau: DEN har du også!
... Det er i hvert fald nødvendigt, hvis vi ønsker at uddanne flere dygtige sygeplejersker. [LINK]	positiv
@USER Jeg hader socialisme, men ville stemme det samme ... df falder for langt uden for hvad der er ordentligt og hvad vi kan være bekendte - det må alle kunne se... S ville jeg så heller ikke stole på. Næsten alle borgerlige partier ville nok gøre det fint hvis df ikke eksisterede.	negativ
Når man er på besøg på en anden afdeling af ens virksomhed og kollegerne der behandler en som en spændende ny livsform og med stor respekt. Det er sgu sjovt :-D #arbejde #menneskerersjove #tillidsvalgt #hygge	positiv
@USER @USER @USER Mette F. har sendt et klart signal og kørt @USER ministerbil i garage. Hans usympatiske "revolverpolitik" hjælper ikke. @USER ødelagde alt for Thorning med deres krav om blå økonomisk politik. Det vil ikke ske for Mette. Kors hvor jeg forstår hende 😍
#dkpol #dkmedier	positiv
Og inden der er nogen der hyler "jammen, de ansatte betaler jo skat", så vil jeg lige påpege, at median-lønnen hos amazon er $28,446, halvdelen af de ansatte hos Amazon tjener altså mindre end 15.702 kr. om måneden. Er det ud af deres løn vi skal tage bidraget til fællesskabet?	negativ
@USER @USER Naturligvis også hos Politiken - går jeg da ud fra - bare først, når Venstre begynder at fremlægge deres egen politik i stedet for at påpege konsekvenser af den hypotetiske situation, hvor modstanderen har udfoldet sin i virkeligheden. #dkpol #dkmedier #fv19	negativ
Kommentar fra @USER Bjarke Oxlund: Brugen af nedsættende ord om homoseksuelle er en del af sportens jargon, og det skal der laves om på! [LINK]
#lgbtidk #dkpol #fodboldforalle @USER @USER @USER	negativ
@USER @USER @USER @USER Ja, det er nemlig ret interessant. Udgangspunktet er at enten skal man opfylde specifikke krav - eller også skal FA vurdere at man “løfter niveauet markant”. Hvordan de så end vil vurdere det!	negativ
I protest mod homofobiske tilråb i fodboldverdenen, har jeg med tilbagevirkende kraft besluttet at boykotte at spille fodbold.

Og ja, det er da fuldkommen irrelevant i det henseende, at jeg ikke kan ramme bolden.	negativ
@USER har tabt sutten - det er jo pinligt, det her: “V-ministre indkaldte til pressemøde for at kritisere Socialdemokratiet”

[LINK]	negativ
🎧 🇲🇦🇩🇰Ny podcast: Danmarks ambassadør i Marokko, Nikolaj Harris, fortæller om Marokkos aktive udenrigs- og sikkerhedspolitik og om landets altoverskyggende prioritet - nemlig kontrollen over det omstridte område, Vestsahara #dkpol #podcastdk #dkmedier 👉
[LINK] [LINK]	neutral
Hvis du ikke forstår forskellen, står du tilbage med en rød regering, og dit parti uden indflydelse overhovedet #dkpol [LINK]	negativ
Jeg formulerer mig ikke altid lige klart. Og jeg ændrer også mening.Sådan er det at være menneske - heldigvis. Og Gud elsker os alligevel - pyha. #tro	positiv
@USER @USER @USER @USER Du er jo helt hjernevasket af kulten :-) Sæt dig ind i hvad socialisme er! Danmark bygger ikke rigtigt på socialisme... Det lyder mere som et konservativt argument du bruger. Du er konservativ men tror du er socialist 😂🤣	negativ
En besynderlig seance udspillede sig på Christiansborg tirsdag formiddag.

Pressemødet handlede om én ting: At iværksætte en skræmmekampagne om, hvad det vil få af betydning for udlændingepolitikken, hvis @USER får regeringsmagten.
#dkpol @USER 

[LINK] [LINK]	negativ
@USER Øh. Det tror jeg bliver svært. Populismen og overbuds politik er hvad det her er. Hvis man ikke kan fjerne folk der brænder romerlys under kampe. Hvordan vil man så gøre det andet!!	negativ
Hvis jeg, mod forventning, nogensinde skulle engagere 3 strippere, så vil jeg ikke engagere de 3...Ligesom jeg ville forvente at høre om deres politik &amp; ikke deres udlægning af andres politik, når de inviterer til pressemøde!
Direkte uskønt med kraftig snert af desperation #dkpol [LINK]	negativ
@USER @USER Alle kan jo blive klogere. men det virker bare modsat, når bif fans temmelig bevidst og som en direkte provokation, synger det dagen efter, og uden at VF er i miles omkreds, det har været et stort tema og noget som der arbejdes på at få væk fra stadion. Brøndby IF tager afstand	negativ
Skønt at endnu flere kolleger får smil på læben og sved på panden sammen med vores foreninger. Vi har medlemsfremgang i 4 ud af 5 regioner #firmaidrætten #DyrkSammenholdet [LINK]	positiv
Efter weekendens homofobiske tilråb mod Viktor Fischer har Aarhus Kommune nu sat en regnbuebænk op foran AGF's hjemmebane. #sldk #ultratwitteragf #agf #fck [LINK]	neutral
@USER Hej Daniel, nu var det jo lige Brøndbyfans, der toppede dumheden i går. Men jeg er sådan set fløjtende ligeglad, hvilket hold du hepper på: Stop homofobi! Det gælder alle klubber og fans, det burde egentligt ikke være nødvendigt at understreg, men nu har du det så sort på hvidt.	negativ
@USER Jeg har skrevet lidt med nogle Barracuda-fans, der mente, det giver fin mening, at han er i DK. De mente nok, han (for ofte) ville blive et healthy scratch. Bliver spændende at se Blichfeld på isen - forhåbentlig mod Sverige i næste uge	neutral
@USER ærespris går i år til @USER - for at formidle forskning. Og for at have holdninger til tobak og alkohol - og for at få forebyggelse på den sundhedspolitiske dagsorden #sundpol #dkpol - tillykke [LINK]	positiv
@USER @USER @USER @USER Det er minimeret til det ekstreme, så måske ikke 0 men meget tæt på. Hvor i udlandet betaler de skat? Tyskland 1-2 % og i UK det samme. Det er noget forbandet svineri.	negativ
Med et ultimatum siger Enhedslisten og @USER nu fra: Hvis Mette F. bøjer sig for de krav til den økonomiske politik, som @USER har gjort til en betingelse, trækker Enhedslisten støtten og udtrykker mistillid [LINK] #dkpol	negativ
Her giver @USER en rammende analyse af dagens pressemøde: "Det er usædvanligt at se et pressemøde, hvor et regeringsparti bruger hele tiden på at gå til angreb på en konkurrent i stedet for at præsentere noget nyt" [LINK] #dkpol #fv19	negativ
@USER @USER @USER @USER Nej, det går ikke. For selvforståelsen vil det være en katastrofe ikke at have hade-objekter. Hvad skulle Inger Støjberg og Mads Fuglede så lave?	negativ
@USER Regeringens strategi er at gøre det til et udlændinge valg ved at konkurrere om, hvem der kan have den mest højrepopulistiske/radikale udlændingepolitik. Venstrefløjens opgave må være at få valget til at handle om økonomi/finans, velfærd og klima.	neutral
Jeg er sindssygt enig i, at præmissen om rød og blå blok er ødelæggende. Medierne kunne gøre en kæmpe forskel, hvis de redefinerede måden de dækker politik på, men desværre er et binært verdensbillede langt mere enkelt at forholde sig til end et systemisk. #dkpol #dkmedier [LINK]	negativ
@USER @USER Ok så holder vi os til ekkokammeret og foragelsen i stedet. Jeg synes nu det kunne være en diskussion værd da dette ikke er at sammenligne med tidligere tider men det må blive en anden gang 😀	positiv
@USER @USER Med sund fornuft skal land bygges... er det det du mener, Perrito. Du mener fortolkningen skal være demokratisk og, at vi skal tilsidesætte højt uddannede specialister bare fordi? Du fremhæver selv filosofi i din beskrivelse; definer lige generel sund fornuft for mig...	negativ
@USER @USER @USER Vil man både have ny regering og ny politik, er S ikke stedet at sætte krydset. En stemme på Socialdemokratiet kan nemlig ende som en stemme på Lars Løkke.
S må forstå at ultimative krav er en blindgyde. En ny regering må baseres på et kompromis mellem partierne bag. #dkpol #FV19 [LINK]	negativ
@USER @USER @USER @USER Du taler udenom. Prøv at forholde dig til at modellen med et prishop er afprøvet i Norge. Resultatet er entydigt godt. Der er markant færre der ryger. Staten tjener stadig penge på rygerne. Og det er på trods af grænsehandel som er en mindst lige så stor udfordring i N som i DK.	negativ
Homofobi. Ikke et nyt fænomen. Omkring 1980 spillede AGF hjemme mod OB. OB's fanskare råbte "Lars Bastrup er homosexuel". Herefter rejste Richard Møller Nielsen sig fra trænerboksen og gik over for at bede fansene stoppe. Det gjorde de så! Et eksempel til efterlevelse? #sldk	positiv
DET KAN BLIVE EN KORT KAMP I BRØNDBY PÅ SØNDAG: "Og havde Jakob Kehlet hørt homofobiske tilråb, ville han have stoppet kampen, men det kan være svært for dommerne at høre alt, hvad der foregår på tribunerne, siger han."#sldk	neutral
@USER @USER Man står frit for at have sin egen mening på oplyst grundlag. Men forskellige meninger skaber debat og måske kunne man lære noget af andre? Det er demokrati!	positiv
Alt for længe har homofobien fået lov at være en integreret del af sportsverdenen, med fodbold i spidsen. 

Det er forrykt når børn og unge lærer at homofobisk jargon hører hjemme på stadion, i klubben, på banen og i... [LINK]	negativ
@USER @USER @USER @USER @USER Man kan sige grimme ting om Enhedslisten, men ikke at at partiet er dumt, Morten Østergaard ønskede en debat om indvandrere for at styrke sit eget parti + @USER fordi han er ligeglad med det sociale i Danmark og mener at udlændinge er vigtigere end danskeres velfærd.	negativ
@USER Takk for god gjennomgang Kasper, meget interessant. At Tibbling havde en down-periode under Zorniger er det vel ingen tvil om, men viser ikke tallene både i kampen mot FCN og de siste kampene at han nærmer seg der han var forrige sesong? Mener du han burde starte inne mod FCK?	positiv
@USER @USER @USER @USER @USER @USER Tror det er ham der er lidt følelseskold. Lad ham være pædagog en uge, så kan vi tage en recap.	negativ
Jeg er kommet til den erkendelse at det faktisk er en fordel at overtage en have, som ikke er velholdt. Alt hvad jeg gør er forbedringer, ikke bare ændringer, det føles rart.	positiv
@USER @USER @USER Det er jo ikke tilfældigt det hedder national SOCIALISME. Han fik stemmer og kom til magten netop på, at alle fik job, velstand, velfærd og en VW. Han var faktisk ret populær i starten indtil det socialistiske slog igennem og alle mistede det hele igen, inklusive demokratiet	negativ
🇳🇴🇳🇴 Det er altid fedt at høre noget om sig selv på norsk! 🇳🇴🇳🇴

Det er så koseligt!

VI ELSKER NORGE! Det gør vi bare! Det gør alle! 😁😍😍

Nu har vi snart 1 års fødselsdag i Norge! 

Heja Norge! 

Kjempe Bra! [LINK]	positiv
GENHØR: The FBI Comedy Tour (April)

Torsdag aften er det igen blevet tid til at få sig et godt grin, når den lokale forening Comedy Rampelys arrangerer comedy night på CC Silkeborg... [LINK]	positiv
Kasper Asgreen er med igennem live i dette sjette afsnit af Holm og Bays Radio Tour, og det er nok ikke svært at gætte, hvad snakken falder på:

"Jeg lukkede bare øjnene og kørte alt, hvad den kunne trække." [LINK]	neutral
RO? Vores unges psykiske mistrivsel stiger! En national strategi mod psykisk mistrivsel bør have fokus på de langsigtede konsekvenser af at fysisk samvær er erstattet af memes og emojis på Snapchat. 

#Børneneførst #dkpol 

[LINK]	negativ
@USER Har snakket med kundeservice. Flink medarbejder vil forsøge at sørge for den kommer frem idag. Det er en pakke til udbringning, hvilket jeg har betalt for. Ja, 25 km er lige i overkanten når jeg kun har 500 m til nærmeste butik. Havde det dog så bare været der...🤪	negativ
@USER @USER Det er nyt for mig, hvis Patrick har trænet MMA tidligere udover de seneste uger. Men selv hvis han har rodet lidt med det i sine unge dage, så har han jo stadig ikke den vigtige kamperfaring og et længere udviklingsforløb at trække på. Så det bliver op ad bakke uanset hvad.	negativ
@USER @USER @USER @USER Gotta love your enthusiasm. Det er lidt ligesom hos os i Verdens Bedste Fødevarer -bortset fra at vores omsætning er ca 107 mio kr mindre :-)	positiv
Findes der en journalist hos #dkmedier, der har mod på at lave den positive historie? Så findes der masser af villige interview-*ofre* i @USER|s tråd, inkl. undertegnede. [LINK]	neutral
@USER @USER @USER Læser det rigtigt. Pointen er at hold kan overpræstere 1-2 sæsoner. Men ikke over tid. Helsingør ligger i dag hvor de skal økonomisk set [LINK]	neutral
HTKom: Danish Open i Taastrup en succes 😄 5 forrygende dage med svømning i topklasse. 8 danske rekorder og 12 svømmere udtaget til VM. ”Vi er dybt imponeret over det set-up, der er blevet etableret på kun 14 dage i Taastrup... [LINK]	positiv
Ved dårligt hva man efterhånden ska sige!?

Igen, igen... igen... slås det fast at vores regering er ude i BEVIDST manipulation for at ramme udlændinge!... &amp; surprise... S støtter dem sgu!?

Ideologi ind.
Fakta ud.

Nu må det faneme være nok!

#dkpol
[LINK]	negativ
Ny leverandør af påskeæg til SFO i Nexø På Paradisbakkeskolens SFO har man i dag traditionen tro fejret påsken. Alt er dog ikke som det plejer. SFO'en har nemlig fået ny leverandør af påskeæg. [LINK]	neutral
@USER Hvor længe finder Ib Poulsen sig i at blive gjort til grin af DFs ledelse som er fuldstændig ligeglad med det arbejde som han går og laver?
Er det nu her kort tid før valget, at han træder i karakter og viser dem at han selv bestemmer hvordan han vil håndtere ministerens svigt?	negativ
@USER @USER Nu når Henriksen formentlig snart bliver arbejdsløs kunne man med fordel overveje at placere ham ved grænsen... er sikker på bare synet ville skræmme både vildsvin og flygtninge langt væk og så ville politiet have tid til at passe deres arbejde #dkpol	negativ
Så lukker Cykelplanen, og der er spildt nogle millioner. Ved godt, at det er let at sige, men jeg synes, at vi har ser et initiativ blandt mange, som vi cyklister ikke har efterspurgt. Jeg efterspørger forbedringer, så jeg ikke så ofte skal sænke hastigheden. #dktrp #cykelpol [LINK]	negativ
En minister kan have begået ulovligheder og løjet for Folketinget, men hvis der er flertal for ulovligheden, så får ministeren en næse, som man kan få mange af uden at det får konsekvenser.	negativ
@USER God journalistik er ikke bestemt af ejerskab, men udelukkende faglighed. Men det er så ikke den uvederhæftige journalistik, der har lukket dit FB-medie, det er heller ikke DR, men kun det faktum, at der er mistanke om fusk med likes.	negativ
@USER @USER @USER @USER Nej hold nu op, det har altså ikke noget med hverken romantik eller pladder at gøre.

Præcis samme mekanisme, som klassisk udbud og efterspørgsel. Limited edition produkter er dyrere, end de kunne være, pga begrænset antal. Ikke fordi de er flottere, bedre eller mere holdbare :)	negativ
SURPRISE! Regeringen lyver hurtigere end en hest kan rende. IGEN! Den "gode politiske håndværker" viser endnu engang hvor bagvendt hans hænder er skruet på. Politikere kan man ikke stole på, slet ikke højrefløjens egopræsident. [LINK]	negativ
Nu falder hammeren over Eva Kjer endnu engang på fiskeriområdet ⚓️👃🏼 Ministeren kan forvente en næse og dermed en hård kritik fra Folketinget i sagen om forsøgsfiskeri i Storebælt #dkpol [LINK]	negativ
@USER @USER Det er helt korrekt at Ø havde og har en vision om en progressiv samling på venstrefløjen. Å var bare ikke klar til det for tre år siden. Siden har SF stillet sig helt ultra tæt på S. Så lige nu ser jeg mest potentiale i samarbejdet primært mellem Ø, Å og B - for at være ærlig.	neutral
Den her kvinde skulle man tro var spidskandidat til elitens fallitbo for venstrefløjen … hun bestiller ikke andet end at kritisere blå blok - hvad siger @USER @USER ?? #dkpol #eudk [LINK]	negativ
"Antallet af børn og unge med psykiatriske diagnoser er eksploderet gennem det seneste årti. I dag har 45.500 under 18 år papir på, at de er psykisk syge" @USER Sind
#psykiatri #sundhedsreform #FV19
@USER @USER
@USER
[LINK]	negativ
@USER Differentieret sprogbrug, er hvad børnene og de voksne skal lære og forstå. Der skal fandme være plads til skurvognen, vi kan ikke alle sammen forventes et passivt aggressivt studentikøst sprogbrug, en spade er en spade og nogle gange er det hele gudhjælpemig noget bøsselort!	negativ
sære tal...

USA henretter flere.
Iran og Pakistan har næsten halveret antallet...

Hvem er det lige der går i den rigtige retning? [LINK]	neutral
@USER Oveni Netflix, HBO, Viaplay, Amazon Prime, som man skal have, for at kunne se det man gerne vil. Er der noget at sige til, at piratkopiering blomstrer...	negativ
@USER @USER @USER @USER, så du mener de analyser de statslige @USER udarbejder af sig selv falder ud af deres pc, mens data selv finder derind?
Ingen ministre har tid til det. De ved de ville være overflødige uden et embedsapparat!
#dkpol #respekt #embedsmisbrug	negativ
@USER Espersen i mimose-mood!? Der kan man bare se :)

Lige her er @USER altså bare en borger, der bruger sin borgerret.
Han er ikke en MF, der misbruger sin MF-autoritet.

PS
Det her sker kun, fordi FT ikke står for transparens og ærlighed mht. partistøtte. Noget i klemme?	negativ
Venstrefløjen forsætter med at være tavse når raketterne falder ned over Israel … det er direkte støtte til Hamas og Iran … og det sædvanlige jødehad på den fløj #dkpol @USER [LINK]	negativ
@USER Det lader til, at det er dét @USER gerne vil. Robotter der brummer læringsstoffet ud i lokalerne til børn der sidder STILLE på deres pladser. I nærheden er kreativitet og elev-forståelse fyret til fordel for klap-hælene-i-og-hør-efter. Trist afvikling. 3-0 til friskolerne	negativ
Meningsmålinger, rammer de inden for deres statistiske usikkerhed - og hvad betyder det overhovedet? Læs med i første del: #dkpol #fv19
[LINK] [LINK]	neutral
Danske ARMYs!🇩🇰

Så er det tid til at ønske #BoyWithLuv i danske radioer &amp; husk vi bliver nødt til at hjælpe allesammen.😘

Skriv på deres FB, send en besked via messenger, gå evt denne liste igennem se om der er radioer I kan skrive /ønske sange hos🙏🥺

[LINK] [LINK]	positiv
@USER Hvis du tror, at en regering baseret på @USER, @USER, @USER og @USER havde gennemført stramninger i samme omfang som vi har gjort siden 2015, så hører jeg dig gerne fremlægge den analyse i #besserwisserne #dkpol	negativ
🙄 Pitchfork var en cool musikblog engang. Nu lyder de som P3. Der var mange fede sange i 2018. Jeg synes dog ikke at nogle af disse er i blandt dem. Snail Mail udsendte et fedt album, men det er næppe en af årets bedste sange. Mærkeligt at man kan opfatte musikår så forskelligt. [LINK]	negativ
@USER @USER Og når det handler om rapporter, som regeringen ikke er enig i, gemmer de den i en skuffe, samtidig med at de kører dobbelspil overfor @USER og kalder det bluff.
[LINK]	negativ
@USER @USER @USER Enig.. det er underligt, at de ikke bare skriver det, når de jo ikke ligefrem har forsøgt at skjule det. Men de agerer vel ikke medie. De laver bare podcasts som 100-vis af andre danskere	neutral
@USER I at straffe to klubber for et problem, der veldokumenteret går på tværs af alle klubber. Det er en pop-reaktion, efter at de ikke har taget deres ansvar seriøst. Og det er problemet med DBU og især disciplinærudvalget. At de altid kun har moral, nær det er billigt og opportunt.	negativ
Så må de fortælle hvilke fordele de mener der er for DK ved at være med I EU? Og spar os for fred i Europa det er NATOs fortjeneste Og handels aftaler kan DK lave bedre og hurtigere end gennem EU bureaukratiet Jeg ser kun ulemper og det bliver værre [LINK]	negativ
@USER @USER Hvis deres påstand er forkert på baggrund af de data de har leveret er det jo helt fint at bede om mere. I dette tilfælde ved jeg ikke om de er fyldestgørende. Det må du vurdere.	neutral
#MetteF @USER siger hun er smidt ud af pensions-forhandlinger, alle andre at hun gik selv … er dronningen af spin i gang igen? #dkpol #dkmedier #politikerlede	neutral
@USER Det komplekse er en afledning. Det er sådan set meget simpelt: Flere hundrede mennesker skal ikke stå og synge sange, der bruger homoseksualitet nedsættende. Det burde være muligt at have en klar holdning til.	negativ
@USER @USER Selvfølgelig er der forskel. Og jeg bakker 100% op om linjen i Superligaen og bøderne til min egen klub og OB.
Men hvis man kun vil gøre det der er nemt, for det er det sgu, så er det hyklerisk.	negativ
@USER Hold nu op. Jeres forslag hjælper jo lige præcis ikke dem, der faktisk kunne have behovet for tidlig pension. Og I kan kun formulere det i overskrifter. Det er jo håbløst at lave forlig om.	negativ
“Min første tanke var, at man da ikke bare melder børn ud af grundskolen, tager små børn ud af daginstitutionen og tvinger en far til at sige sit job op, uden at nogen instans tager hånd om dem efterfølgende i rets- og velfærdsstaten Danmark. Men det gjorde man”#paradigmeskift [LINK]	negativ
@USER @USER Det kan jo slet ikke forslå. Men den regnemetode som Finansministeriet benytter skal du forvente at der skal forhøjes med yderligere kr. 225.000 oven i det som den enkelte skal have.
Det bliver megadyret og er vel grunden til at V ikke har fremlagt noget. #dkpol	negativ
@USER @USER @USER @USER @USER @USER @USER @USER @USER Hvor holder du ikke et pressemøde om jeres forslag til pension? Vi vil så gerne vide, om I stadig ønsker at hæve pensionalderen. #TingVenstreIkkeHolderPressemødeOm #dkpol	neutral
@USER Bare rolig. Det er helt normalt aprilvejr. Vi brugte et par minutter at forklare det i aftenens program 😊se det på [LINK] 👌	positiv
@USER @USER @USER Det er det, men det at være nærig er et af de mest almindelige turn offs. 

Så kan man gøre det uden er det vel helt okay? 🤔	negativ
@USER @USER @USER @USER Jeg synes, DBU er kommet i klemme. Vi har nogle (for mange) tosser ombord, der brugt en uacceptabel måde at varme op til derby. Det SKAL DBU reagere på. Problemet er, de har tolereret det i mange år og taler nu om nul-tolerance. Derved bliver det til en pseudo-holdning	negativ
V og andre liberalistiske kræfter fortsætter deres kamp mod fællesskabet og det sociale sikkerhedsnet som de har gjort siden Kanslergadeforliget, derfor er S ude.#dkpol [LINK]	negativ
🤔 TÆNK DIG GRUNDIGT OM, FØR DU SKAL STEMME 🤔

💚🙏❤️

PS: Jeg kan ikke finde Mette på nogen af billederne. Hvordan kan det være? Hvilken ‘blok’ er hun og S en del af?

#dkpol
#dkmedier
#alternativet
#dereretalternativ 
#grøntvalg 
#tidtilforandring
#derforuffe [LINK]	positiv
Hvorfor synes ministeren, at rapporten er så farlig? Såmænd bare at den dokumenterer det, som de fleste af os allerede ved og i øvrigt er almindelig snusfornuft. Vi kan blandt andet læse, at... [LINK]	negativ
E-mail markedsføring for eksisterende kunder 📧📧📧

Det er vigtigt at I gør jeres kunder opmærksomme på, at I stadig er der. Det kan bl.a. være en påmindelse om service eller andre spændende tilbud der skal sendes... [LINK]	neutral
@USER @USER @USER 3/3 Men det kunne da være interessant at høre, hvorfor du er uenig i at skatter og statsobligationer ikke finansierer statens forbrug? Altså at konsolidering af Nationalbankens og resten af statens balance ikke er valid.	negativ
Det giver mening, at folkepensionsalderen følger udviklingen i levetiden. Det giver også mening, at vi har en seniorførtidspensionordning. Det er en dårlig ide at give specielle faggrupper, der har været på arbejdsmarkedet i bestemt tid, en særret. Alt for bureaukratisk #dkpol	negativ
@USER @USER Vi har brug for en lang årrække, uden immigranter/flygtninge i Danmark. At nogle af dem er nemme er intigrere er godt, men mange lever i et paralelt samfund, og vil gøre det i generationer. Er et kæmpe problem.	negativ
@USER @USER Hvis det lykkes, og ordningen ikke ender i kommunalt bureaukrati, så tager jeg hatten af, for ude i de 98 kommuner synes det som om bogholdermentaliteten styrer... Det er uværdigt, så vil være en super nyhed 😇	positiv
@USER On second thought... spørgsmålene om dit syn "danske værdier" ligner et forsøg på politisk profilering af dig, ligesom dette spørgsmål [LINK]	negativ
