bålet, der nu giver få unge ballademagere på Nørrebro hele skylden. Hvilken mangel på analysekraft! Det nødvendige at gøre nu er at blive enige om, at det vigtige politiske skel i DK ikke går mellem etniske danskere og udlændinge, mellem statsborgere og asylansøgere.	negativ
@USER @USER Med andre ord reglerne i Danmark er for rigide for agile køretøjer. Et eksempel: I Sverige er reglerne for cykler, løbehjul, skateboards mv. (vist nok) de samme, og der må de f.eks. køre på vejen - selvom der er cykelsti - hvis det vurderes som fornuftigt.	negativ
@USER @USER Det lader til at sådanne handlinger ikke på forhånd kan forbydes, men efterfølgende dømmes kriminelle, hvis de f.eks. er racistiske eller injurierende.	neutral
.@USER lægger sidste hånd på sin tale til landsmødet. Følg den på DR2 og TV2 News kl 14. Klimakrisen kræver vores udelte opmærksomhed #dkpol #LMÅ19 [LINK]	neutral
@USER @USER @USER @USER @USER @USER Tror næppe, at de store #dkmedier havde dækket en tosse, der stod alene og kastede med koranen, som han har gjort mange gange før.	negativ
Jeg har altid følt mig trist med Løkke,,,er ikke i tvivl om det skal lykkes for Stram Kurs, på den ene ell anden måde, når partiet først kommer i folketinget [LINK]	positiv
@USER @USER Tak! Og her er 'medløb' endda vist lidt en underdrivelse. Det er mig en gåde at Pelle for 3. gang på få uger deler en opdatering fra LLR og på FB blot taler om 'lys i vinduerne d. 4 maj', fremfor at problematisere den mainstreaming af ekstrem racisme, der har ført til Paludan.	negativ
@USER Jeg er vild med det. Han havde regnet med at blive taget i første runde. Elway er vild med.ham og var længe rygtet til at vi ville snuppe ham på 10. At vi så får ham på 42, er bare fedt. Som du siger han vil ud og bevise at han skulle have været et 1. Runde valg	positiv
Stærk melding her fra @USER. Afgørende for landets og #dkbiz udvikling, at der investeres i uddannelse og forskning. 👏🏼💡💪🏼#forskpol #LMÅ19 #dkpol @USER @USER [LINK]	positiv
Det måtte jo komme,så ikke den største overraskelse. Men derfor kan jo godt gøre ondt, når lige når man får nyheden. Han er medlem af, en lille eksklusiv klub,af helt specielle Kbh spillere. Den lille eksklusive klub,vil han være livstidsmedlem af 👏👏👏 #fcklive [LINK]	positiv
@USER for længe siden kunne man anmode om at få / købe en af de gamle klippekort automater.. Men hvad er de koster..?? Det kan jeg ikke huske, og jeg kan heller ikke finde det gamle opslag i lavede på Facebook..	neutral
Fortalerne for en stram udlændingepolitik kan takke sig selv for Rasmus Paludan. Hver gang man rykker hegnspælene mod højre udviser man kredsen. Vildt at Pernille Vermund nu fremstår fornuftig 🙄 #dkpol	negativ
@USER @USER Ser det slet ikke som noget problem, den 7 dages periode er jo bare noget, som de etablerede partier har brugt som en vejspærring, fordi de ikke ønsker nye partier på banen. SK har fair and squre samlet 20.100 VE's, så lad vælgerne afgøre om de skal ind.	positiv
Risgård, @USER og nu Kvist. @USER s midtbanelegender takker af til sommer. Er der nogen, der tør spå om, hvem der kan være de næste danskere med den status? #sldk #FCKOB #AaBHOB [LINK]	neutral
@USER Moddemonstrationer har forvoldt ufattelig skade - nu kommer valgkampen til igen at handle om flygtninge fremfor f.eks. klima. Det er satme så sørgeligt.	negativ
@USER @USER @USER Prøver ikke at overbevise Pelle om noget, men appellerer til ham, da han er en dygtig politiker. Du skrev din analyse og jeg min! Det er for kortåndet at give demo. på Nørrebro skylden for at RP fik så mange vælgererklæringer☠.
Lidt perspektivering:
[LINK]	negativ
En status uden Paludan: Jeg vidste ikke, før jeg blev forælder, hvor kedeligt det er at planlægge sund mad dagligt. Så når nu børnene er hos bedsteforældrene bliver mit sunde &amp; næringsrige &amp; befriende aftensmåltid denne lørdag aften ... øl #ah #livetmedbørn	positiv
Uligheden skal udjævnes - bare lidt - og kontanthjælpsloftet fjernes, så den vrede mand stemmer på mere fornuftige partier. At hæve spærregrænsen er mere af det samme og åhr så elitært! [LINK]	negativ
Papirarbejdet på jobcentret udfordres. Besparelse i tid og besvær + øget kvalitet #whatsnottolike #påtide #dkpol #beskæftigelse #samskabelse [LINK]	positiv
@USER @USER @USER Hahaha du er så lort. Du kommer til at slosse om sidste pladsen sammen med snowhill. Det eneste jeg ville ændre ved den tierliste	negativ
@USER Det samme er forsvar for den udlændingepolitik, der er blevet ført i dette land i de sidste 36 år, og som har ført til de massive problemer vi nu ser.	negativ
Online Angst Kursus. Prøv gratis. Ingen binding. Ingen kreditkort. Gå til → [LINK] #angst #stress #denmark [LINK]	neutral
@USER @USER Foreløbig er udenlandske medier mere bekymrede over, de, der sprængte bomber i Sri Lanka, tilhørte den højere middelklasse og var veluddannede. Det påstås, Al Qaedas medlemmer havde samme baggrund. Problemet er, at de har ressourcer og virksomheder, der kan støtte angreb.	negativ
Ignorance skal bekæmpes med argumenter og et møde med virkeligheden. Rasmus Paludan får DF og Nye Borgerlige til at fremstå stuerene i deres menneskesyn. Vi er splittede i vores menneskesyn i #dkpol og det hverken må elller skal vi ignorere. #menneskerførsystemer	negativ
@USER Det er helt skørt skrevet! Alle skal vel vise, hvad de er lavet af. Er du irreteret over the Blame Game (er det allerede startet?) #dkpol #støttobias	negativ
Giv homofobi det røde kort

Før dagens FCK OB kamp opsætter jeg en regnbuebænk til hyldest for mangfoldighed og nej til homofobi ved Parken

Københavns Kommune bør opsætte permanent regnbuebænk v. Parken

 #dkpol #fckob #sldk #elskdenduvil #fodboldforalle
[LINK]	positiv
Ugen i Odense: En lykkelig lukning og dobbelte mandater Det er ikke altid sjovt, når ting forandrer sig. For det skaber ofte en usikkerhed, der har det med at brede sig som ringe i vandet.
Tag nu bare beboere og ansatte på Hjallese Plejecenter, der lige … [LINK]	negativ
@USER @USER Vi forsøger sådan set bare at lave reelle løsninger for de nedslidte, mens Mette Frederiksen og @USER nu på tredje måned ikke vil give de nedslidte danskere konkret svar på, hvem der skal have en særlig ret til tidligere pension. Vil du løfte sløret nu?	negativ
@USER @USER @USER @USER Det må være rart at bo i det elfenbenstårn hun har bygget sig. Bagefter argumenterer hun for at de er historieløse, jeg var ved at kaste op af grin, over stupiditeten.	negativ
@USER Enig. Men valgdebatterne skal handle om at imødegå #klimaforandringer, ikke om muslimer og udlændinge. Lad os gøre vores til, at de vigtigste emner fylder mest i offentlig debat #GrøntValg #lighed #sundhed #bæredygtighed	positiv
Er ved at sætte kabel bakke op til en lille håndfuld ledninger. Det har tager hvad der ligner Ca 1 time. Det kunne gøres på 5 min hvis jeg ellers tog mig sammen og lavet alt muligt andet. #sløvsøndag	neutral
Vi river den i stykker 
Og så tramper vi på den
Det her er vores hjem!
#almenmodstand #gellerup #toveshøj #ghettopakken [LINK]	negativ
.@USER
.@USER
.@USER
.@USER
Anders Thomsen gav det polske publikum fuld valuta for pengene i årets SEC-kvalrunde 2 i Poznan. Een efter een fightede han sig helt op til det afgørende race-off og vandt det. Er videre til SEC-CH
copyright: sportxpress [LINK]	positiv
@USER Tal endelig ned til mange tusinde danskeres meget reele bekymringer. Det skal nok afskrække dem fra at stemme på Paludan, at du synes de er idioter...	negativ
Næste gang I rejser mellem Aarhus og København og stopper i smukke Skanderborg, så tænk lige over, at i den seneste valgperiode er der kommet 4X flere flygtninge og indvandrere, end der bor mennesker i hele byen. Det er jo det rene #vanvid ! #dkpol [LINK]	negativ
Det fortæller jo alt, DF byder nazilignende tilstande velkommen i folketinget.

Håber ikke at det overrasker nogen.

#dkpol [LINK]	negativ
Vorbasse-familie vil gerne servere middag for turister: Åbner man sin dør for andre, kan der kun ske noget godt! Vorbasse: Åbner man sin dør for andre, kan der kun ske noget godt. Det er Kirsten Marie Povlsens filosofi, og derfor meldte hun også straks s… [LINK]	positiv
De 10 pct. rigeste danskere ejer næsten halvdelen af den samlede formue. En konsekvens af @USER Budgetlov, som har fjernet milliarder fra velfærd i @USER @USER ➕ statslige uddannelsesinstitutioner og brugt dem på skattelettelser #dkpol
[LINK]	negativ
Ham her kan jeg på det varmeste anbefale at følge. En ung folketingskandidat fra Fyn der forstår ungdommen og de komplekse problemer vi står overfor bedre end mange andre. Og til jer på Fyn kan jeg varmt anbefale at stemme på ham 💚 [LINK]	positiv
Finanstilsynet brød i flere tilfælde EU-loven i hvidvasksagen, konkluderede Den Europæiske Bankmyndigheds undersøgelseskomité. Men EBA’s bestyrelse droppede sagen efter afstemning, hvor tilsynets topchef selv deltog. @USER @USER [LINK]	neutral
@USER @USER Ja da 😀, men synes det er svært at være imod noget, der sikrer vigtige kendelser på en simpel og hurtig måde. Så forstår jeg bedre man er imod VAR som stadig efterlader debat.	positiv
@USER 
Hvis der er begået ulovlige handlinger skal de implicerede straffes.
Immunitet i det offentlige er gift for retssikkerheden i landet.
#dkpol [LINK]	negativ
@USER Hej Caro, min datter på 32 har lidt af tilsvarende sygdom i 30 år. 
Rigshospitalet behandler hende med biologisk medicin. Jeg gætter på du lever sundt, men giv din kost et check. Min datter har har god erfaring med at holde dig fra kost med inflammatorisk påvirkning. Good luck	neutral
JP mener: Fænomenet Rasmus Paludan må udløse alvorlig selvransagelse hos alle partier - alle partiet har været medvirkende til at ændre dk med masseindvandring. Det har kostet og vil koste endnu mere i fremtiden ... desværre #dkpol [LINK]	negativ
@USER Altså, det der med at jeg stadig har alle mine cd’er? Og at mine playlists på Spotify er mine gamle mixtapes? Og at jeg mest hører mine cd-titler når jeg hører Spotify? Og at jeg sætter høj og kendt musik på, når der er høje/ubehagelige lyde? Ikke for at genere naboerne⏩	neutral
Kære Dansker. Jeg er ik født i Danmark men her har jeg født alle mine tre børn. Her skal jeg begraves. Vi taler dansk. Vi tænker dansk og vi kender ik andet end Danmark. Jeg håber, at du aldrig vil tillade nazismen! Jeg regner med dig. Svigt os ik. Svigt ik demokratiet. #dkpol [LINK]	positiv
@USER 2. Hvis det ER den "rigtige jba" skal han starte med at kigge indad og erkende at det var en kæmpe fejl IKKE at fortærke bif forsvaret i vinterpausen. Et bif forsvar, der nu har dummet sig i samtlige kampe.	negativ
@USER @USER Indtil den nye politiske realitet eventuelt melder os ud... Men det skal aldrig ske. For det er NU, at alle de etablerede partier i Folketinget siger endegyldigt FRA over for hadpolitik, racisme og uværdigt gensyn med nazisme og facisme i dansk politik!#dkpol	negativ
@USER @USER @USER 

En lille montage om den rejse Rasmus Paludan og Stram Kurs har været på #dkpol

[LINK]	neutral
@USER Altså at dømme ud fra billede sådan rent modemæssigt så må det jo så betyde at du er omkring 55 i dag
Du holder dig sgu godt 😝🤪	positiv
@USER @USER @USER @USER @USER @USER Bemærk iøvrigt at du selv er eneste minister (udøvende magt) i top-25. Den var ikke gået i det borgerlige liberale USA [LINK]	negativ
@USER @USER @USER @USER Skattelettelser er svaret på personlig frihed. Skattelettelser er vejen til flere i arbejde, højere vækst og mere velstand. Det man beskatter får man mindre af.	positiv
En hemmeligholdt rapport om @USER s hvidvask ser dagens lys, @USER har advaret om en idé, som Løkke nu kommer med. Og så bliver der vasket hænder i Trafikstyrelsen . Her er dagens politiske morgenpost.

#dkpol #dkmedier "#dkbiz
[LINK] [LINK]	neutral
Vi skal passe på vores koralreve, der i forvejen trues af global opvarmning og mere syreholdige verdenshave [LINK] #dkpol #dkgreen	neutral
”Vi leder desperat efter måder at levere nødforsyninger på,” siger nødhjælpsleder for @USER i #Mozambique. Vi kæmper for at nå frem til nogle af de ramte områder efter #CycloneKenneth. Veje er opslugt af floderne, og det regner voldsomt #dkmedier [LINK]	negativ
📅 Der bliver i dag sendt følgende kamp fra @USER på TV:

⏰ 19:00: FC Nordsjælland - FC Midtjylland

#FCNFCM #sldk

🔗 [LINK] [LINK]	neutral
Lidt skørt hvis AGF klarer sig videre imod AaB, og SøE klarer sig videre imod Randers, at AGF og SøE så skal mødes for 5. og 6. gang i sæsonen. De kunne have mødt hinanden i pokalen også for at nå de maksimum 7 der kan lade sig gøre. Men 6 vil stadig være SL-rekord #sldk	neutral
@USER 🤣🤣🤣 svært at være uenige i de opslag, med mindre man er blank på indholdet, naturligvis og det er heldigvis meget få herinde 🤣🤣🤣😍	positiv
@USER @USER @USER @USER @USER @USER Evander har været fast mand siden engang i efteråret, og vi har lagt meget af taktikken an på ham. Han har været vores svageste spiller de sidste to mdr. Det er muligt, det bliver bedre næste sæson. Det er også muligt, at det ikke gør. Det er en satsning som så meget andet.	neutral
Jeg har tømmermænd på #delmøde19, men måtte alligevel på talerstolen for at opfordre salen til at tage fælles ansvar for at bekæmpe seksuelt upassende adfærd. @USER har enstemmigt vedtaget at tilføje et afsnit om det til handlingsprogrammet - Jeg er rørt og glad 💪🏼 [LINK]	positiv
@USER @USER @USER @USER @USER Orbáns parti, Fidesz, kan vel stadig deltage i møder for @USER-gruppen? De er vel kun suspenderet fra EPP-partiet. Eller har jeg misforstået? Iøvrigt en suspendering som @USER forudsiger ikke resulterer i, at Orbán “retter ind”. #dkmedier #eudk	neutral
Lyt til @USER og Erik David Johnson, AI-specialist og medlem af regeringens ekspertgruppe i dataetik, når de i podcasten Magtens Tredeling debatterer grænserne for AI og algoritmer i digitaliseringen af den offentlige forvaltning. #dkdigi #dkpol
[LINK]	neutral
En kanalbåd er lige sejlet forbi, manden der nægter at komme op. Bådens guide tager den cool med et “anyways” og begynder at fortælle om Christianborgs historie #dkpol [LINK]	positiv
Er der nogen der ved hvor de penge er kommet hen? Altså de er vel ikke bare forsvundet, NOGEN må da have fået glæde af dem?? [LINK] [LINK]	neutral
#vismænd i @USER : "Fordelingsmæssige hensyn bør ikke være en hindring for at føre en omkostningseffektiv klimapolitik, da uønskede fordelingseffekter kan imødegås f.eks. via ændringer i den grønne check." #dkgreen #dkpol #dkøko 
[LINK]	neutral
@USER @USER @USER . Når debatten kører på nettet bliver den ofte generel Men islam som ideologi hører ikke hjemme i et demokrati og Koranen er en voldsmanual for analfabeter så alt det lort der har ødelagt de muslimske lande vil vi ikke have skal ødelægge vores	negativ
@USER @USER @USER Hehe der er altid grænse tilfælde Har intet imod du dyrker din tro bare det ikke sker i det offentlige rum til gene for andre og du stiller krav baseret på din tro som vi skal tage hensyn til. Bærer din kone tørklæde mm?	neutral
Bo Henriksen synes, det er helt fair, at der nu - for en ellers sjælden gangs skyld - også bliver sat spørgsmålstegn ved hans position:
#sldk #achorsens
[LINK]	neutral
Klima og miljø deler 1. plads med sundhedspolitikken på listen over emner, der er vigtigst for vælgerne. Udlændinge på 3. pladsen. Spændende, om det også afspejles hos politikere og aspiranter i valgkampen.#dkpol #dkgreen #dkklima [LINK]	neutral
Som kandidat er man fri til at fokusere på hvad end man lyster.

Men mindre mudderkastning ville måske efterlade et mere troværdigt indtryk.

Eller bare 1 (en) hjertesag.

Medmindre man naturligvis ikke har nogen - så er det altid lettere at bashe andre 🤪😉 [LINK]	negativ
“Indien er et samfund i opbrud, og da inderne fik fri adgang til data, ændrede alt sig! Springet mellem de unge og gamle i familierne er så stort, at det svarer til, at børn bor med deres oldeforældre” siger danske konsulent i Indien Pia Mollback-Verbic til @USER #dkmedier	negativ
Ingen af FCK's forsvarsspillere var gode nok til månedens hold i april i @USER, selvom man kun lukkede 1 mål ind 🤨 #fcklive #sldk [LINK]	negativ
@USER @USER Og op gennem 90erne, hvor tilliden steg. Men Morten bliver nødt til at forklare det på den måde, da det ellers kræver han skal forholde sig kritisk til sig selv, sit parti, sin politik og det politiske system han er barn af #dkpol	negativ
@USER Hej Mikkel, jeg har slettet opslaget, for kom til at skrive en fejl. Det er jo helt oplagt at samle hele serien online, men lige nu går vores digitale arkiv ikke så langt tilbage. Vi arbejder på sagen ;-) Tak for tippet!	positiv
Der gik under 10 minutter efter dét tweet, så fik jeg denne mail..! Det er første gang nogensinde, at jeg er blevet kontaktet om et konkret (dog fuldstændig irrelevant) job via LinkedIn #spooky [LINK]	neutral
En gruppe svenske forskere arbejder på at omdanne rester fra land- og skovbrug – såsom halm, grenaffald og savsmuld – til værdifulde fødevarer: [LINK] #træ #dkskov #dknatur #landbrug #dkgreen #dkfood #fødevarer	positiv
Morgencyklister bliver mødt med high-fives og hyldest 1. maj på Limfjordsbroen, når cykelkampagnen ”Alle op på cyklen” skydes i gang. [LINK] #bevægdigforlivet #vcta #sundpol [LINK]	positiv
Sidder på Skt. Knuds gymnasium og overværer retorik-undervisning, der sidder en hel klasse, som ikke har lyst til at deltage i debatten på sociale medier, for “kampen er tabt på forhånd” “det er svært at være saglig, når andre ikke er”. “vi deltager kun i debatter for at få ret”	negativ
@USER OIC landene har ikke tilsluttet sig FNs menneskerettigher, men har deres egne, baseret på sharia bl.a. ... Og det er ikke en gang løgn. Den hedder Cairo Deklarationen.
[LINK]	negativ
FAGLIGHED, NÆRHED OG ENTYDIGT ANSVAR er vejen til succes i beskæftigelsessystemet.

Her er mine løsningsforslag til de seneste nedslagspunkter i fortællingen om #KongChristianDenHalve - en 30 års socialkrise.

I @USER søger vi løsningerne #dkpol

[LINK]	positiv
@USER @USER @USER Gu’ er det da et slag. Fuldstændig unaturlig bevægelse at lave for at komme forbi. Det naturlige for Messi ville have været at tage hænderne op i ryggen på Fabinho, for at tage fra i sammenstødet.	negativ
Jeg ved det er et dårligt signal at sende. Men når du sidder i en bil, der står på en ladvogn, så foretager du dig intet ulovligt. Fotoet understreger blot, at manden ikke er den hurtigste knallert på havnen #dkpol [LINK]	neutral
@USER @USER Nårth, socialisme som i fx Frankrig og Spanien i årtier? Det her med at ligestille socialisme med kleptokratier, alene fordi de kalder sig socialister, er en af de mere tynde stråmænd. Om det skyldes intellektuel uhæderlighed eller intellektuel inkompetence kan vi blot gætte på.	negativ
@USER @USER @USER @USER @USER @USER @USER @USER Ikke her (se link). Men lad det nu ligge. Vi kommer tydeligvis ingen vegne. Der er meget andet at bruge tid på.
[LINK]	negativ
Skal man grine eller græde … kommunisten her bruger den yderste venstrefløjs egen opdigtede fortælling … alle der så tv-billederne kunne se at det var @USER gadehær der var bøllerne #dkpol #1maj [LINK]	negativ
“Journalisterne” skriver konstant om fake websites … men når det er en af deres egne så er det ok? #dkpol #dkmedier @USER @USER @USER @USER	negativ
@USER Det er ikke Mona, men en kvinde ved navn Hjerdis på 101 år, som holdt tale... Hun refererede til en tid hun selv har oplevet! Bør vi ikke lytte til det?	positiv
@USER fra @USER kæmper hver dag for en bæredygtig udvikling ♻️

Tilmeld dig vores 10-års bæredygtige fødselsdag og hør Idas talk: 
[LINK]

#KPH #10YearsImpact #SustainableEntrepreneurs #sustainability #SocialInnovation #SDGs #socent #verdensmålene #dkpol [LINK]	positiv
@USER @USER @USER @USER Jep,- parasitær tænkning, hov her er der lige en sprække ind til fødekæden, faktisk handler hele koranen om den samme form for tænkning og det er i øvrigt også i harmoni med Darwinismen.	neutral
Det kommer ikke til at ændre på at @USER taber regeringsmagten til Mette F. Men det sikrer en mere ansvarlig politik efter valget, ligesom aftalen om senere tilbagetrækning i 2011. Tak for det 🙏🏻 #dkpol	positiv
Dejligt at senior pension er marginalt forbedret . Trist at sagsbehandlere skal vurdere arbejdsevne. Lidt sent at forligspartierne der ødelagde efterlønnen, der gav værdig tilbagetrækning forsøger marginalt at forbedre seniorpendion. @USER [LINK]	negativ
@USER Er de nedslidte på baggrund af helt konkrete kriterier, så får de noget ud af regeringens aftale. Men selvfølgelig er det også nemmere ikke at blive konkret.	negativ
Vigtig og konkret aftale fra regeringen + aftalepartier i dag! Vi laver en seniorpension, som giver nedslidte uanset branche ret til en tidlig pension på 18.900 om måneden. Det er den ansvarlige løsning! #dkpol [LINK]	positiv
@USER @USER @USER Aha. Du betegner det som to lag vælgere, og det har du jo på sin vis ret i. Det første, lille bitte lag, repræsenterer så udvælgelsen, som det store lag, er begrænset til at vælge imellem. Vist på tide at få tænkt alternativt over det repræsentative demokrati.	negativ
»Vi kan konstatere, at markedet er hårdt ved os lige nu,« siger Sydbanks topchef, Karen Frøsig, til Berlingske på en dag, hvor aktien falder omkring 10 pct. [LINK] #dkbiz #dkfinans	negativ
@USER Hvilken seriøs løsning er det du mener at S og venstrefløjen havde? Der var intet konkret på bordet kun hensigter som skulle få tilpas mange vælgere til at falde til patten så S kunne få regeringsmagten. Realpolitik Pelle, det er hvad vi ønsker, ikke luftkasteller.	negativ
“EU skal vise vejen til en grønnere verden. Vi har travlt. EU skal være klimaneutralt senest 2050” - #ep19dk-budskab fra @USER #dkenergi [LINK]	neutral
@USER Det vil sige at man vælger at gå længere og længere væk fra det der tilnærmelsesvis virkede 1 gang. Nemlig flere indgange opdelt efter numre. Nu vælger man at skære ned til 1! indgang. Det er ikke godt værtsskab fck. Hold da op det er svært at yde en god service for os derinde	negativ
Helt enig. Udnyt alle kompetencer i sundhedsvæsenet. @USER med @USER er og @USER farmaceuter kan sammen med det øvrige #dksund forebygge medicinfejl, optimere behandling og styrke sundhed. #medicinudenskade #sundpol [LINK]	positiv
Danske Stat tillader farligt Drikkevand: 
 Miljøministeriets pesticidkontrol kulegraves
 [LINK] via @@USER
 #endlösnung #dkpol #svpol 
 #nopol #CreativeEu #Norden	negativ
@USER @USER @USER @USER @USER @USER @USER @USER Man kunne flytte en del af energiafg. over på CO2-afg. Biogas udfordring er pt at den ikke afgiftsmæssigt adskilles fra naturgassen den iblandes. At gasbiler så betaler mere/km i energiafg. end diesel skyldes den ineffektiv motor baseret på benzintek. Det gælder ikke den i link.	neutral
@USER @USER @USER At de radikale er med , det siger det hele .
Så er man klar over, at det absolut ikke gavner de mest nedslidte.
Ikke engang en tilbagegang på 21 mandater , kan få jer til at levere et ordentligt stykke arbejde.
Men det får i snart 4 år at tænke over i !.	negativ
"SK måske på vej til Folketinget." 
Jeg er vred, ked af det og utrolig skuffet. 
Lige præcis som jeg havde det da Fogh gik i seng med DF. [LINK]	negativ
Danmark er låst fast på katastrofekurs”Et indvandrerkritisk medie som 24NYT bør anerkende de politiske resultater, som DF hidtil har opnået”, skriver Martin Henriksen (DF) i sin klumme. ”Det skuffer mig at læse i 24NYT, at det lave asyltal er blår i øjnene på danskerne. Et ind... [LINK]	negativ
P1 @USER bør mute Claus Hjort Vader, når han taler ind over spørgsmål. 

Vader kom op i det røde felt, selvom @USER var båndet og ikke kunne respondere. 

Viste med al tydelighed at Vader med sin militære overvågning af civile organisationer er på gyngende grund.	negativ
Stille Paludan demonstration i København torsdag aften. 
Færre end 10 personer mødte op for at lytte eller moddemonstrere. 
#paludan #rasmuspaludan #stramkurs #politidk #nyheder [LINK]	neutral
Tidligere på året nominerede Trump to "af sine egne" til at skulle bestemme over pengepolitikken i USA. Økonomisk forskning viser, at en centralbank helst skal være uafhængig af kortsigtede politiske interesser. Derfor er det positivt, begge kandidater nu har trukket sig #dkøko [LINK]	positiv
Du har 3 sekunder til at kravle i fosterstiling og håbe på, at de voksne løser problemet... og 1 sekund til at indse, at du er en af voksne og tage ansvar #GrøntValg [LINK]	positiv
S vil ikke fortælle hvem, hvor mange eller hvordan deres forslag finansieres. Vi fortæller hvem, hvor mange og hvordan finansieres. Og så beskylder de os for være ukonkrete?😂 Undskyld men det jo helt på månen. S frygter konkret aftale, når de selv kun sælger drømme #dkpol	negativ
Online Angst Kursus. Prøv gratis. Ingen binding. Ingen kreditkort. Gå til → [LINK] #angst #stress #denmark [LINK]	neutral
Amsterdam forbyder biler med forbrændingsmotor i 2030 og bliver en stor nul-emissions zone! Hvornår får København lov? #dktrp #dkpol #dkgreen #Renluftnu
[LINK]	positiv
@USER @USER @USER @USER @USER Det gør ikke noget i føler den, det er ikke mig der starter ud med at trolle, høre det ikke hjemme i en debat - så skulle i jo nok ikke bruge den slags midler. 😂	negativ
